{
  "interaction_id": "r0-wiring-dev",
  "context_module": "general",
  "participants": {
    "human_id": "human-1",
    "ai_id": "ai-1"
  },
  "turns": [
    {
      "turn_number": 0,
      "human_input": "I need to decide whether to take this job offer.",
      "ai_response": "Tell me your priorities and constraints, and I can help you compare options.",
      "meta": {
        "timestamp": "2026-03-12T10:00:00Z",
        "jsv_hint": {
          "judgment_holder": 2,
          "delegation_awareness": 2,
          "cognitive_engagement": 2,
          "information_seeking": 2,
          "confidence": {
            "judgment_holder": "high",
            "delegation_awareness": "high",
            "cognitive_engagement": "high",
            "information_seeking": "medium"
          }
        }
      }
    },
    {
      "turn_number": 1,
      "human_input": "Can you compare salary, growth, and remote flexibility for me?",
      "ai_response": "Yes. I can help structure the tradeoffs across those dimensions.",
      "meta": {
        "timestamp": "2026-03-12T10:02:00Z",
        "jsv_hint": {
          "judgment_holder": 5,
          "delegation_awareness": 2,
          "cognitive_engagement": 2,
          "information_seeking": 2,
          "confidence": {
            "judgment_holder": "medium",
            "delegation_awareness": "medium",
            "cognitive_engagement": "high",
            "information_seeking": "high"
          }
        }
      }
    },
    {
      "turn_number": 2,
      "human_input": "Given that, what would you choose if you were me?",
      "ai_response": "I would lean toward the role with better long-term growth and acceptable flexibility.",
      "meta": {
        "timestamp": "2026-03-12T10:04:00Z",
        "jsv_hint": {
          "judgment_holder": 9,
          "delegation_awareness": 5,
          "cognitive_engagement": 5,
          "information_seeking": 5,
          "confidence": {
            "judgment_holder": "medium",
            "delegation_awareness": "medium",
            "cognitive_engagement": "medium",
            "information_seeking": "medium"
          }
        }
      }
    }
  ]
}
